{
  "schema": "harness-ultragoal.product-live-surface-receipt.v1",
  "surface": "parent_operation_coordination",
  "evidence": [
    {
      "path": "docs/product-fitness-and-quality-in-use.md",
      "digest": "sha256:135341d618fdb786a5c60dbb32c96c3d98129663e66c347b90769b96b9ad5f58"
    },
    {
      "path": "templates/PRODUCT_FITNESS_RECEIPT.json",
      "digest": "sha256:661e15ab26860a795f7f7b88eb34a2e03a3e5a3bb14f54616697a7b2e8a65824"
    }
  ],
  "substitutions_rejected": [
    "cli_fixture_success",
    "install_success",
    "package_publication",
    "reviewer_agreement",
    "smoke_test"
  ],
  "claim_ceiling": "same_live_surface_only"
}
